vllm_metax/model_executor/layers/fused_moe/configs/H=4096/H=4096,E=288,N=160,device_name=MXC500,dtype=int8_w8a8.json
{
    "1": {
        "stage1": {
            "BLOCK_SIZE_M": 16,
            "BLOCK_SIZE_N": 64,
            "BLOCK_SIZE_K": 128,
            "GROUP_SIZE_M": 64,
            "num_warps": 4,
            "num_stages": 4,
            "SPLIT_K": 2,
            "pipeline": "cpasync",
            "scenario": "unroll"
        },
        "stage2": {
            "BLOCK_SIZE_M": 16,
            "BLOCK_SIZE_N": 64,
            "BLOCK_SIZE_K": 64,
            "GROUP_SIZE_M": 64,
            "num_warps": 4,
            "num_stages": 2,
            "SPLIT_K": 1,
            "pipeline": "basic",
            "scenario": ""
        }
    },
    "2": {
        "stage1": {
            "BLOCK_SIZE_M": 16,
            "BLOCK_SIZE_N": 64,
            "BLOCK_SIZE_K": 256,
            "GROUP_SIZE_M": 64,
            "num_warps": 4,
            "num_stages": 3,
            "SPLIT_K": 1,
            "pipeline": "cpasync",
            "scenario": "unroll"
        },
        "stage2": {
            "BLOCK_SIZE_M": 16,
            "BLOCK_SIZE_N": 128,
            "BLOCK_SIZE_K": 64,
            "GROUP_SIZE_M": 16,
            "num_warps": 4,
            "num_stages": 3,
            "SPLIT_K": 1,
            "pipeline": "cpasync",
            "scenario": "unroll"
        }
    },
    "4": {
        "stage1": {
            "BLOCK_SIZE_M": 16,
            "BLOCK_SIZE_N": 32,
            "BLOCK_SIZE_K": 128,
            "GROUP_SIZE_M": 1,
            "num_warps": 4,
            "num_stages": 2,
            "SPLIT_K": 1,
            "pipeline": "basic",
            "scenario": ""
        },
        "stage2": {
            "BLOCK_SIZE_M": 16,
            "BLOCK_SIZE_N": 128,
            "BLOCK_SIZE_K": 64,
            "GROUP_SIZE_M": 1,
            "num_warps": 4,
            "num_stages": 2,
            "SPLIT_K": 1,
            "pipeline": "cpasync",
            "scenario": "unroll"
        }
    },
    "6": {
        "stage1": {
            "BLOCK_SIZE_M": 16,
            "BLOCK_SIZE_N": 32,
            "BLOCK_SIZE_K": 128,
            "GROUP_SIZE_M": 64,
            "num_warps": 4,
            "num_stages": 2,
            "SPLIT_K": 1,
            "pipeline": "basic",
            "scenario": "unroll"
        },
        "stage2": {
            "BLOCK_SIZE_M": 16,
            "BLOCK_SIZE_N": 128,
            "BLOCK_SIZE_K": 64,
            "GROUP_SIZE_M": 1,
            "num_warps": 4,
            "num_stages": 1,
            "SPLIT_K": 1,
            "pipeline": "basic",
            "scenario": "storeCoalesce"
        }
    },
    "8": {
        "stage1": {
            "BLOCK_SIZE_M": 16,
            "BLOCK_SIZE_N": 64,
            "BLOCK_SIZE_K": 128,
            "GROUP_SIZE_M": 1,
            "num_warps": 4,
            "num_stages": 2,
            "SPLIT_K": 1,
            "pipeline": "cpasync",
            "scenario": "storeCoalesce"
        },
        "stage2": {
            "BLOCK_SIZE_M": 16,
            "BLOCK_SIZE_N": 128,
            "BLOCK_SIZE_K": 64,
            "GROUP_SIZE_M": 1,
            "num_warps": 4,
            "num_stages": 2,
            "SPLIT_K": 1,
            "pipeline": "cpasync",
            "scenario": "storeCoalesce"
        }
    },
    "12": {
        "stage1": {
            "BLOCK_SIZE_M": 16,
            "BLOCK_SIZE_N": 64,
            "BLOCK_SIZE_K": 128,
            "GROUP_SIZE_M": 1,
            "num_warps": 4,
            "num_stages": 3,
            "SPLIT_K": 1,
            "pipeline": "cpasync",
            "scenario": ""
        },
        "stage2": {
            "BLOCK_SIZE_M": 16,
            "BLOCK_SIZE_N": 128,
            "BLOCK_SIZE_K": 64,
            "GROUP_SIZE_M": 1,
            "num_warps": 4,
            "num_stages": 1,
            "SPLIT_K": 1,
            "pipeline": "basic",
            "scenario": ""
        }
    },
    "16": {
        "stage1": {
            "BLOCK_SIZE_M": 16,
            "BLOCK_SIZE_N": 64,
            "BLOCK_SIZE_K": 128,
            "GROUP_SIZE_M": 32,
            "num_warps": 4,
            "num_stages": 2,
            "SPLIT_K": 1,
            "pipeline": "basic",
            "scenario": "unroll"
        },
        "stage2": {
            "BLOCK_SIZE_M": 16,
            "BLOCK_SIZE_N": 128,
            "BLOCK_SIZE_K": 64,
            "GROUP_SIZE_M": 1,
            "num_warps": 4,
            "num_stages": 1,
            "SPLIT_K": 1,
            "pipeline": "basic",
            "scenario": "storeCoalesce"
        }
    },
    "20": {
        "stage1": {
            "BLOCK_SIZE_M": 16,
            "BLOCK_SIZE_N": 64,
            "BLOCK_SIZE_K": 128,
            "GROUP_SIZE_M": 1,
            "num_warps": 4,
            "num_stages": 3,
            "SPLIT_K": 1,
            "pipeline": "cpasync",
            "scenario": ""
        },
        "stage2": {
            "BLOCK_SIZE_M": 16,
            "BLOCK_SIZE_N": 128,
            "BLOCK_SIZE_K": 64,
            "GROUP_SIZE_M": 32,
            "num_warps": 4,
            "num_stages": 3,
            "SPLIT_K": 1,
            "pipeline": "cpasync",
            "scenario": ""
        }
    },
    "24": {
        "stage1": {
            "BLOCK_SIZE_M": 16,
            "BLOCK_SIZE_N": 64,
            "BLOCK_SIZE_K": 128,
            "GROUP_SIZE_M": 1,
            "num_warps": 4,
            "num_stages": 3,
            "SPLIT_K": 1,
            "pipeline": "cpasync",
            "scenario": ""
        },
        "stage2": {
            "BLOCK_SIZE_M": 16,
            "BLOCK_SIZE_N": 128,
            "BLOCK_SIZE_K": 64,
            "GROUP_SIZE_M": 16,
            "num_warps": 4,
            "num_stages": 4,
            "SPLIT_K": 1,
            "pipeline": "cpasync",
            "scenario": "storeCoalesce"
        }
    },
    "28": {
        "stage1": {
            "BLOCK_SIZE_M": 16,
            "BLOCK_SIZE_N": 64,
            "BLOCK_SIZE_K": 128,
            "GROUP_SIZE_M": 32,
            "num_warps": 4,
            "num_stages": 3,
            "SPLIT_K": 1,
            "pipeline": "cpasync",
            "scenario": "storeCoalesce"
        },
        "stage2": {
            "BLOCK_SIZE_M": 16,
            "BLOCK_SIZE_N": 128,
            "BLOCK_SIZE_K": 64,
            "GROUP_SIZE_M": 32,
            "num_warps": 4,
            "num_stages": 1,
            "SPLIT_K": 1,
            "pipeline": "basic",
            "scenario": "unroll"
        }
    },
    "32": {
        "stage1": {
            "BLOCK_SIZE_M": 16,
            "BLOCK_SIZE_N": 64,
            "BLOCK_SIZE_K": 128,
            "GROUP_SIZE_M": 32,
            "num_warps": 4,
            "num_stages": 2,
            "SPLIT_K": 1,
            "pipeline": "basic",
            "scenario": "unroll"
        },
        "stage2": {
            "BLOCK_SIZE_M": 16,
            "BLOCK_SIZE_N": 128,
            "BLOCK_SIZE_K": 64,
            "GROUP_SIZE_M": 16,
            "num_warps": 4,
            "num_stages": 1,
            "SPLIT_K": 1,
            "pipeline": "basic",
            "scenario": ""
        }
    },
    "40": {
        "stage1": {
            "BLOCK_SIZE_M": 16,
            "BLOCK_SIZE_N": 64,
            "BLOCK_SIZE_K": 128,
            "GROUP_SIZE_M": 1,
            "num_warps": 4,
            "num_stages": 3,
            "SPLIT_K": 1,
            "pipeline": "cpasync",
            "scenario": ""
        },
        "stage2": {
            "BLOCK_SIZE_M": 16,
            "BLOCK_SIZE_N": 128,
            "BLOCK_SIZE_K": 64,
            "GROUP_SIZE_M": 16,
            "num_warps": 4,
            "num_stages": 1,
            "SPLIT_K": 1,
            "pipeline": "basic",
            "scenario": ""
        }
    },
    "48": {
        "stage1": {
            "BLOCK_SIZE_M": 16,
            "BLOCK_SIZE_N": 64,
            "BLOCK_SIZE_K": 128,
            "GROUP_SIZE_M": 1,
            "num_warps": 4,
            "num_stages": 3,
            "SPLIT_K": 1,
            "pipeline": "cpasync",
            "scenario": "storeCoalesce"
        },
        "stage2": {
            "BLOCK_SIZE_M": 16,
            "BLOCK_SIZE_N": 128,
            "BLOCK_SIZE_K": 64,
            "GROUP_SIZE_M": 32,
            "num_warps": 4,
            "num_stages": 1,
            "SPLIT_K": 1,
            "pipeline": "basic",
            "scenario": "unroll"
        }
    },
    "56": {
        "stage1": {
            "BLOCK_SIZE_M": 16,
            "BLOCK_SIZE_N": 64,
            "BLOCK_SIZE_K": 128,
            "GROUP_SIZE_M": 1,
            "num_warps": 4,
            "num_stages": 3,
            "SPLIT_K": 1,
            "pipeline": "cpasync",
            "scenario": "storeCoalesce"
        },
        "stage2": {
            "BLOCK_SIZE_M": 16,
            "BLOCK_SIZE_N": 128,
            "BLOCK_SIZE_K": 64,
            "GROUP_SIZE_M": 64,
            "num_warps": 4,
            "num_stages": 1,
            "SPLIT_K": 1,
            "pipeline": "basic",
            "scenario": "storeCoalesce"
        }
    },
    "64": {
        "stage1": {
            "BLOCK_SIZE_M": 16,
            "BLOCK_SIZE_N": 64,
            "BLOCK_SIZE_K": 128,
            "GROUP_SIZE_M": 32,
            "num_warps": 4,
            "num_stages": 2,
            "SPLIT_K": 1,
            "pipeline": "basic",
            "scenario": "unroll"
        },
        "stage2": {
            "BLOCK_SIZE_M": 16,
            "BLOCK_SIZE_N": 128,
            "BLOCK_SIZE_K": 64,
            "GROUP_SIZE_M": 64,
            "num_warps": 4,
            "num_stages": 1,
            "SPLIT_K": 1,
            "pipeline": "basic",
            "scenario": "unroll"
        }
    },
    "96": {
        "stage1": {
            "BLOCK_SIZE_M": 16,
            "BLOCK_SIZE_N": 64,
            "BLOCK_SIZE_K": 128,
            "GROUP_SIZE_M": 1,
            "num_warps": 4,
            "num_stages": 3,
            "SPLIT_K": 1,
            "pipeline": "cpasync",
            "scenario": ""
        },
        "stage2": {
            "BLOCK_SIZE_M": 16,
            "BLOCK_SIZE_N": 128,
            "BLOCK_SIZE_K": 64,
            "GROUP_SIZE_M": 1,
            "num_warps": 4,
            "num_stages": 3,
            "SPLIT_K": 1,
            "pipeline": "cpasync",
            "scenario": "unroll"
        }
    },
    "128": {
        "stage1": {
            "BLOCK_SIZE_M": 16,
            "BLOCK_SIZE_N": 64,
            "BLOCK_SIZE_K": 128,
            "GROUP_SIZE_M": 1,
            "num_warps": 4,
            "num_stages": 3,
            "SPLIT_K": 1,
            "pipeline": "cpasync",
            "scenario": ""
        },
        "stage2": {
            "BLOCK_SIZE_M": 16,
            "BLOCK_SIZE_N": 128,
            "BLOCK_SIZE_K": 64,
            "GROUP_SIZE_M": 32,
            "num_warps": 4,
            "num_stages": 3,
            "SPLIT_K": 1,
            "pipeline": "cpasync",
            "scenario": "unroll"
        }
    },
    "256": {
        "stage1": {
            "BLOCK_SIZE_M": 16,
            "BLOCK_SIZE_N": 64,
            "BLOCK_SIZE_K": 128,
            "GROUP_SIZE_M": 1,
            "num_warps": 4,
            "num_stages": 3,
            "SPLIT_K": 1,
            "pipeline": "cpasync",
            "scenario": "storeCoalesce"
        },
        "stage2": {
            "BLOCK_SIZE_M": 16,
            "BLOCK_SIZE_N": 128,
            "BLOCK_SIZE_K": 64,
            "GROUP_SIZE_M": 32,
            "num_warps": 4,
            "num_stages": 3,
            "SPLIT_K": 1,
            "pipeline": "cpasync",
            "scenario": "unroll"
        }
    },
    "512": {
        "stage1": {
            "BLOCK_SIZE_M": 32,
            "BLOCK_SIZE_N": 64,
            "BLOCK_SIZE_K": 128,
            "GROUP_SIZE_M": 1,
            "num_warps": 8,
            "num_stages": 2,
            "SPLIT_K": 1,
            "pipeline": "basic",
            "scenario": "storeCoalesce"
        },
        "stage2": {
            "BLOCK_SIZE_M": 32,
            "BLOCK_SIZE_N": 128,
            "BLOCK_SIZE_K": 64,
            "GROUP_SIZE_M": 1,
            "num_warps": 4,
            "num_stages": 1,
            "SPLIT_K": 1,
            "pipeline": "cpasync",
            "scenario": "storeCoalesce"
        }
    },
    "1024": {
        "stage1": {
            "BLOCK_SIZE_M": 64,
            "BLOCK_SIZE_N": 128,
            "BLOCK_SIZE_K": 128,
            "GROUP_SIZE_M": 1,
            "num_warps": 4,
            "num_stages": 4,
            "SPLIT_K": 1,
            "pipeline": "cpasync",
            "scenario": "unroll"
        },
        "stage2": {
            "BLOCK_SIZE_M": 64,
            "BLOCK_SIZE_N": 256,
            "BLOCK_SIZE_K": 64,
            "GROUP_SIZE_M": 1,
            "num_warps": 4,
            "num_stages": 4,
            "SPLIT_K": 1,
            "pipeline": "cpasync",
            "scenario": "storeCoalesce"
        }
    },
    "1536": {
        "stage1": {
            "BLOCK_SIZE_M": 64,
            "BLOCK_SIZE_N": 128,
            "BLOCK_SIZE_K": 128,
            "GROUP_SIZE_M": 1,
            "num_warps": 4,
            "num_stages": 4,
            "SPLIT_K": 1,
            "pipeline": "cpasync",
            "scenario": "unroll"
        },
        "stage2": {
            "BLOCK_SIZE_M": 64,
            "BLOCK_SIZE_N": 256,
            "BLOCK_SIZE_K": 64,
            "GROUP_SIZE_M": 1,
            "num_warps": 4,
            "num_stages": 4,
            "SPLIT_K": 1,
            "pipeline": "cpasync",
            "scenario": "storeCoalesce"
        }
    },
    "2048": {
        "stage1": {
            "BLOCK_SIZE_M": 64,
            "BLOCK_SIZE_N": 128,
            "BLOCK_SIZE_K": 256,
            "GROUP_SIZE_M": 1,
            "num_warps": 4,
            "num_stages": 4,
            "SPLIT_K": 1,
            "pipeline": "cpasync",
            "scenario": "storeCoalesce"
        },
        "stage2": {
            "BLOCK_SIZE_M": 64,
            "BLOCK_SIZE_N": 256,
            "BLOCK_SIZE_K": 64,
            "GROUP_SIZE_M": 1,
            "num_warps": 4,
            "num_stages": 4,
            "SPLIT_K": 1,
            "pipeline": "cpasync",
            "scenario": "storeCoalesce"
        }
    },
    "3072": {
        "stage1": {
            "BLOCK_SIZE_M": 128,
            "BLOCK_SIZE_N": 128,
            "BLOCK_SIZE_K": 128,
            "GROUP_SIZE_M": 1,
            "num_warps": 4,
            "num_stages": 4,
            "SPLIT_K": 1,
            "pipeline": "cpasync",
            "scenario": "storeCoalesce"
        },
        "stage2": {
            "BLOCK_SIZE_M": 128,
            "BLOCK_SIZE_N": 128,
            "BLOCK_SIZE_K": 32,
            "GROUP_SIZE_M": 1,
            "num_warps": 4,
            "num_stages": 2,
            "SPLIT_K": 1,
            "pipeline": "basic",
            "scenario": "storeCoalesce"
        }
    },
    "4096": {
        "stage1": {
            "BLOCK_SIZE_M": 128,
            "BLOCK_SIZE_N": 128,
            "BLOCK_SIZE_K": 128,
            "GROUP_SIZE_M": 1,
            "num_warps": 4,
            "num_stages": 4,
            "SPLIT_K": 1,
            "pipeline": "cpasync",
            "scenario": ""
        },
        "stage2": {
            "BLOCK_SIZE_M": 128,
            "BLOCK_SIZE_N": 128,
            "BLOCK_SIZE_K": 32,
            "GROUP_SIZE_M": 1,
            "num_warps": 4,
            "num_stages": 2,
            "SPLIT_K": 1,
            "pipeline": "basic",
            "scenario": ""
        }
    },
    "8192": {
        "stage1": {
            "BLOCK_SIZE_M": 128,
            "BLOCK_SIZE_N": 128,
            "BLOCK_SIZE_K": 128,
            "GROUP_SIZE_M": 1,
            "num_warps": 4,
            "num_stages": 4,
            "SPLIT_K": 1,
            "pipeline": "cpasync",
            "scenario": "storeCoalesce"
        },
        "stage2": {
            "BLOCK_SIZE_M": 128,
            "BLOCK_SIZE_N": 128,
            "BLOCK_SIZE_K": 128,
            "GROUP_SIZE_M": 1,
            "num_warps": 4,
            "num_stages": 4,
            "SPLIT_K": 1,
            "pipeline": "cpasync",
            "scenario": "storeCoalesce"
        }
    }
}